{"admissions":{"mathgraph.l4yaml.48-case-qualification":{"assumptions":[],"kind":"formal","outcome":"SUPPORT","scope":"nasa-jpl/L4YAML@62bf7077910e888a0bc8adfc8e08a5f500ff3ca3:yaml/yaml-test-suite@da267a5c4782e7361e82889e76c0dc7df0e1e870:48-cases","source":"jpl-record.json","verifier":"pinned-jpl-qualified-receipt-v1"},"openai.original_publication_receipt.1":{"assumptions":[],"kind":"documentary","outcome":"SUPPORT","scope":"openai/math:Algebraicity of Weil classes on split abelian eightfolds:original-withdrawn-edition","source":"history.md","verifier":"pinned-publisher-notice-v1"},"openai.original_publication_receipt.2":{"assumptions":[],"kind":"documentary","outcome":"SUPPORT","scope":"openai/math:Algebraicity of Kuga–Satake Correspondences for K3 Surfaces:original-withdrawn-edition","source":"history.md","verifier":"pinned-publisher-notice-v1"},"openai.original_publication_receipt.3":{"assumptions":[],"kind":"documentary","outcome":"SUPPORT","scope":"openai/math:The rational Hodge conjecture for products of K3 surfaces:original-withdrawn-edition","source":"history.md","verifier":"pinned-publisher-notice-v1"}},"members":{"history.md":{"sha256":"41c2a2d470014b3628695c7aabf5fd0c93f6f687621fca172062f22b59ed6a1e","size":2281},"jpl-record.json":{"sha256":"7b59ee76a39995f35a0feb0f4d91a3c6ab1234393143480c4f3e361a79fee703","size":4321},"record.json":{"sha256":"0a850b112cce200f2fa97f0d861db712f3752712a6326e62f4c0d56996a95d87","size":5290}},"provenance":{"prior_independent_replay":{"actions_run":"38025236380","commit":"9b3189a64825e2cb6ebc7b5c17f5f193bdf5cfe3","independently_owned":false,"repository":"heathsanchez/realitygraph"},"producer":{"actions_run":"38025044631","commit":"040456fc8862c79c8b384ce63846628274b678be","repository":"metalogiclabs/mathgraph"}},"schema":"mathgraph.resolve-trust-policy.v1"}
